{"altername_name": ["DoReMi Fantasy: Milon no DokiDoki Daibouken"], "name": "DoReMi Fantasy: Milon's DokiDoki Adventure", "overview": "DoReMi Fantasy: Milon's DokiDoki Adventure (\u30c9\u30ec\u30df\u30d5\u30a1\u30f3\u30bf\u30b8\u30fc \u30df\u30ed\u30f3\u306e\u30c9\u30ad\u30c9\u30ad\u5927\u5192\u967a \"DoReMi Fantasy: Milon no DokiDoki Daibouken\") is a platform game developed and published by Hudson Soft for the Super Famicom. The game is a sequel to the 1988 NES game, Milon's Secret Castle, and was released exclusively in Japan on March 22, 1996. It was later re-released for the Wii's Virtual Console in North America in March 2008, and in Europe in September 2008. These versions were not translated from the original Japanese language. In the game, Milon, a young boy, heads in a mission to restore the music from the forest of his hometown and rescue his friend, the fairy Alis, from an evil wizard known as Amon, who is also responsible for the music's disappearance. To do this, he must collect a series of magic instruments that are being held by Amon's strongest minions. However, said instruments have had their power locked away after Amon corrupted them, so Milon must also collect stars to purify the instruments.", "platform": "Nintendo Wii", "release_date": "2008", "game_type": "Released", "esrb": "", "developers": "Hudson Soft", "publishers": "Hudson Soft", "genres": "Platform", "max_players": "", "cooperative": "No", "rating": "3.5", "wikipedia": "https://en.wikipedia.org/wiki/DoReMi_Fantasy", "video_link": "", "launchbox_gamesdb_link": "https://gamesdb.launchbox-app.com/games/details/93656-doremi-fantasy-milons-dokidoki-adventure\n"}