{"altername_name": [], "name": "Tecmo Bowl: Kickoff", "overview": "Tecmo Bowl: Kickoff is an American football video game developed by Polygon Magic and published by Tecmo for the Nintendo DS. A remake of Tecmo Super Bowl, the game was released on November 18, 2008, The game features team cities almost identical to the NFL. The only difference is a Los Angeles team instead of the New York Giants. You can edit the team names, uniforms, and players to your liking. The game features the following improvements and changes to the original game - Customizable teams: players are now able to choose team colors, emblems, player names, team cities and abilities - Super abilities: players can use power-ups during the game - Customizable playbook: players are able to choose the plays for each team's playbook - Cutscenes: certain plays cause cinematic representations of the play", "platform": "Nintendo DS", "release_date": "November 18, 2008", "game_type": "Released", "esrb": "", "developers": "Tecmo", "publishers": "Tecmo", "genres": "Sports", "max_players": "", "cooperative": "No", "rating": "4.5", "wikipedia": "", "video_link": "", "launchbox_gamesdb_link": "https://gamesdb.launchbox-app.com/games/details/8889-tecmo-bowl-kickoff\n"}