{"altername_name": ["Never 7: The End of Infinity"], "name": "Infinity", "overview": "Never 7: The End of Infinity is a visual novel video game developed by KID. It was originally published under the name Infinity for the Sony PlayStation, and has since been released on multiple platforms. The game is the first title in the Infinity series, and is followed by 'Ever 17: The Out of Infinity', 'Remember 11: The Age of Infinity', '12Riven: The Psi-Climinal of Integral', and 'Code_18'. Makoto is a student who never attends the lectures at the school. As a punishment, he has to attend an extra seminar on an island with other classmates. However, when he arrives on the island, strange thing start happening. A girl is found dead on April 6th, with a small bell in her hand. Immediately after that, Makoto finds himself in bed and sees the date - April 1st! Was the vision of the girl just a dream, or does he possess the power to predict the future? This is what he will have to find out as a series of strange deaths make his seminar much more suspenseful than he would have thought.", "platform": "Sony Playstation", "release_date": "March 23, 2000", "game_type": "Released", "esrb": "", "developers": "Kid", "publishers": "KID", "genres": "Visual Novel", "max_players": "1", "cooperative": "No", "rating": "4.83", "wikipedia": "https://en.wikipedia.org/wiki/Never_7:_The_End_of_Infinity", "video_link": "", "launchbox_gamesdb_link": "https://gamesdb.launchbox-app.com/games/details/157416-infinity\n"}