{"altername_name": ["Cross Tantei Monogatari"], "name": "Cross Tantei Monogatari: Motsureta Nanatsu no Labyrinth", "overview": "Cross Tantei Monogatari: Motsureta Nanatsu no Labyrinth is a Japanese adventure game about a young man named Ken Koruso that hopes to become a detective and solve the mystery behind the car accident that killed his father. The title was the very first game created by WorkJam, a developer founded by Yutaka Kaminaga that famously took over the Tantei Jinguji Saburo franchise after the closing of Data East. Cross Tantei Monogatari was initially released for the Sega Saturn in Japan on June 6, 1998 and featured seven different episodes that had their own mysteries to solve. The following year a PlayStation port was released that contained several enhancements including the main character being fully voiced among other improvements. A discounted version was also published in 2000 that was separated into two titles with episodes 1-4 being in the first game and episodes 5-7 in second game.", "platform": "Sega Saturn", "release_date": "June 25, 1998", "game_type": "Released", "esrb": "Not Rated", "developers": "WorkJam", "publishers": "WorkJam", "genres": "Adventure", "max_players": "1", "cooperative": "No", "rating": "3.67", "wikipedia": "", "video_link": "", "launchbox_gamesdb_link": "https://gamesdb.launchbox-app.com/games/details/115474-cross-tantei-monogatari-motsureta-nanatsu-no-labyrinth\n"}