{"altername_name": [], "name": "Rocky's Boots", "overview": "Rocky's Boots is an educational logic puzzle game by Warren Robinett and Leslie Grimm, published by The Learning Company in 1982. It was released for the Apple II, the CoCo, the Commodore 64 the IBM PC and the IBM PCjr. It was followed by a more difficult sequel, Robot Odyssey. It won Software of the Year awards from Learning Magazine (1983), Parent's Choice magazine (1983), and Infoworld magazine (1982, runner-up), and received the Gold Award (for selling 100,000 copies) from the Software Publishers Association. It was one of the first educational software products for personal computers to successfully use an interactive graphical simulation as a learning environment.", "platform": "Apple II", "release_date": "1982", "game_type": "", "esrb": "", "developers": "Warren Robinett", "publishers": "The Learning Company", "genres": "", "max_players": "", "cooperative": "No", "rating": "4.88", "wikipedia": "https://en.wikipedia.org/wiki/Rocky%27s_Boots", "video_link": "", "launchbox_gamesdb_link": "https://gamesdb.launchbox-app.com/games/details/113841-rockys-boots\n"}