{"altername_name": [], "name": "Impossible Mission II", "overview": "Impossible Mission II is a 1988 computer game developed by Novotrade and published by Epyx. It was released for the Commodore 64, ZX Spectrum, Amstrad CPC, Enterprise 64 and 128, Nintendo Entertainment System, MS-DOS based PCs, Atari ST, Apple IIe with at least 128K, Apple IIc, Apple IIGS and Amiga computers. In 2004, it was one of the games featured on the C64 Direct-to-TV. Impossible Mission II is a direct sequel to Epyx's 1984 game Impossible Mission. The game follows directly from the same plot, with Elvin Atombender seeking revenge, and the player having to stop him. The overall game structure and basic gameplay is mostly similar, but there are a few differences and new features.", "platform": "Enterprise", "release_date": "1988", "game_type": "", "esrb": "", "developers": "Novotrade", "publishers": "Epyx", "genres": "Action", "max_players": "1", "cooperative": "No", "rating": "4", "wikipedia": "", "video_link": "", "launchbox_gamesdb_link": "https://gamesdb.launchbox-app.com/games/details/42044-impossible-mission-ii\n"}