{"name": "Under Night In-Birth Exe:Late[st] ", "overview": "Under Night In-Birth (\u30a2\u30f3\u30c0\u30fc\u30ca\u30a4\u30c8\u30a4\u30f3\u30f4\u30a1\u30fc\u30b9, And\u0101 naito inv\u0101su) is a visual novel and 2D fighting game co-developed by Ecole Software and French-Bread, known for the licensed fighting game, Type-Moon\u2019s Melty Blood series. Since its initial arcade release in Japan, Under Night In-Birth has received numerous version updates, adjusting various system features and character attributes as well as adding several new playable characters to the roster.<br><br>A further update to the game entitled Under Night In-Birth Exe:Late[st] (\u30a2\u30f3\u30c0\u30fc\u30ca\u30a4\u30c8\u30a4\u30f3\u30f4\u30a1\u30fc\u30b9\u30a8\u30af\u30bb\u30ec\u30a4\u30c8\u30a8\u30b9\u30c8, And\u0101 naito inv\u0101su ekusereito esuto) was announced on May 15, 2015.[36] Under Night In-Birth Exe:Late[st] was released on PlayStation 3, PlayStation 4 and PlayStation Vita in Japan on July 20, 2017,[37] then in North America and Europe on February 9, 2018.[6] Exe:Late[st] was also released on Steam for Microsoft Windows systems on August 20, 2018. Exe:Late[st] is then re-titled to the update below, Exe:Late[cl-r], for those who owned PlayStation 4 and Windows versions.", "platform": "Arcade", "release_date": "May 15, 2015", "game_type": "Released", "esrb": "", "developers": "Arc System Works", "publishers": "Arc System Works", "genres": "Fighting", "max_players": "2", "cooperative": "No", "rating": "4.17", "wikipedia": "", "video_link": "", "launchbox_gamesdb_link": "https://gamesdb.launchbox-app.com/games/details/129871"}