{"altername_name": [], "name": "Telenet Shooting Collection", "overview": "Telenet Shooting Collection is a compilation of shoot 'em up games developed by the now-defunct studio Telenet Japan and published by Edia for the Nintendo Switch. It was released on June 8, 2023, in Japan. Telenet Shooting Collection compiles four high-definition ports of shoot 'em up games developed by Telenet Japan: Granada (1990), Gaiares (1990), Avenger (1990), and Psychic Storm (1992). The ports of Granada and Gaiares are based on the Sega Genesis versions of the games while the ports of Avenger and Psychic Storm use the PC Engine versions of the games. Each game will have additional features such as new \"Sound Modes\", a new \"Visual Mode\", a rewind feature, and other added features and updates.", "platform": "Nintendo Switch", "release_date": "June 8, 2023", "game_type": "Released", "esrb": "", "developers": "Edia", "publishers": "Edia", "genres": "Action", "max_players": "", "cooperative": "No", "rating": "None", "wikipedia": "", "video_link": "", "launchbox_gamesdb_link": "https://gamesdb.launchbox-app.com/games/details/370010-telenet-shooting-collection\n"}