{"altername_name": ["Hokuto No Ken"], "name": "Fist of the North Star", "overview": "Fist of the North Star is a 2D competitive fighting game produced by Sega and developed by Arc System Works, based on the manga series of the same name. It was originally released in 2005 as a coin-operated arcade game for the Atomiswave hardware. A PlayStation 2 port, retitled Hokuto no Ken: Shinpan no S\u014ds\u014dsei Keng\u014d Retsuden, roughly translated as Fist of the North Star: The Twin Blue Stars of Judgment - History of the Fist Masters), was released exclusively in Japan in March 2007. The arcade version was officially distributed by Sega in North America, while the PS2 port was released only in Japan. In 2020, a homebrew conversion was released for the Dreamcast.", "platform": "Sega Dreamcast", "release_date": "2020", "game_type": "Unreleased", "esrb": "", "developers": "Arc System Works", "publishers": "Sega", "genres": "Fighting", "max_players": "2", "cooperative": "No", "rating": "3.88", "wikipedia": "", "video_link": "", "launchbox_gamesdb_link": "https://gamesdb.launchbox-app.com/games/details/370464-fist-of-the-north-star\n"}